{
  "$schema": "https://json-schema.org/draft/2020-12/schema",
  "additionalProperties": false,
  "$id": "urn:threadleaf:spec:v1:theme-schema",
  "type": "object",
  "required": [
    "schemaVersion",
    "uri",
    "threadleafVersion",
    "colorSchemes",
    "themeContract",
    "assetIds",
    "limits",
    "cascade",
    "gates"
  ],
  "properties": {
    "schemaVersion": {
      "const": 1
    },
    "uri": {
      "const": "urn:threadleaf:spec:v1:themes"
    },
    "threadleafVersion": {
      "type": "string"
    },
    "colorSchemes": {
      "type": "array",
      "items": {
        "type": "string"
      },
      "uniqueItems": true
    },
    "themeContract": {
      "type": "object",
      "required": ["version", "uri", "tokens", "stateCues", "schemes", "source"],
      "properties": {
        "version": {
          "type": "integer",
          "minimum": 1
        },
        "uri": {
          "type": "string",
          "pattern": "^urn:threadleaf:theme:v[0-9]+$"
        },
        "tokens": {
          "type": "array",
          "minItems": 1,
          "items": {
            "type": "object",
            "required": ["name", "role"],
            "properties": {
              "name": {
                "type": "string",
                "pattern": "^--[a-z0-9-]+$"
              },
              "role": {
                "type": "string",
                "minLength": 1
              }
            },
            "additionalProperties": false
          }
        },
        "stateCues": {
          "type": "array",
          "minItems": 1,
          "items": {
            "type": "object",
            "required": ["state", "cue"],
            "properties": {
              "state": {
                "type": "string",
                "minLength": 1
              },
              "cue": {
                "type": "string",
                "minLength": 1
              }
            },
            "additionalProperties": false
          }
        },
        "schemes": {
          "type": "array",
          "items": {
            "type": "string"
          },
          "uniqueItems": true
        },
        "source": {
          "type": "string"
        }
      },
      "additionalProperties": false
    },
    "assetIds": {
      "type": "array",
      "items": {
        "type": "object",
        "required": ["kind", "prefix", "source"],
        "properties": {
          "kind": {
            "type": "string"
          },
          "prefix": {
            "type": "string"
          },
          "source": {
            "type": "string"
          }
        },
        "additionalProperties": false
      }
    },
    "limits": {
      "type": "array",
      "items": {
        "type": "object",
        "required": ["id", "bytes", "unit", "display", "source"],
        "properties": {
          "id": {
            "type": "string"
          },
          "bytes": {
            "type": "integer",
            "minimum": 0
          },
          "unit": {
            "enum": ["bytes", "entries"]
          },
          "display": {
            "type": "string"
          },
          "source": {
            "type": "string"
          }
        },
        "additionalProperties": false
      }
    },
    "cascade": {
      "type": "array",
      "items": {
        "type": "object",
        "required": ["order", "layer", "source"],
        "properties": {
          "order": {
            "type": "integer"
          },
          "layer": {
            "type": "string"
          },
          "source": {
            "type": "string"
          }
        },
        "additionalProperties": false
      }
    },
    "gates": {
      "type": "array",
      "items": {
        "type": "object",
        "additionalProperties": false,
        "required": ["path", "command"],
        "properties": {
          "path": {
            "type": "string",
            "pattern": "^[^/][^\\n]*$"
          },
          "command": {
            "type": "string",
            "minLength": 1
          }
        }
      }
    }
  }
}
